{
  "$schema": "https://json-schema.org/draft/2020-12/schema",
  "$id": "independent-assurance-case.schema.json",
  "title": "Independent Assurance Case",
  "description": "Optional non-authorizing reference object for independent evaluation evidence. A qualification_evidence object is a submitted bounded summary of a Foundations Qualification Evidence Record. This profile does not independently authenticate the native artifact. Native authenticity remains external evidence. Positive independent assurance requires outcome QUALIFIED inside an inclusive interval: qualified_from <= evaluation_time <= expires_at. CONDITIONAL does not satisfy this profile.",
  "type": "object",
  "properties": {
    "subject_id": { "type": "string" },
    "version": { "type": "string" },
    "configuration_digest": { "type": "string" },
    "evaluator": {
      "type": "object",
      "properties": {
        "identity": { "type": "string" },
        "interests_disclosed": { "type": "boolean" }
      }
    },
    "scope": { "type": "string" },
    "method": { "type": "string" },
    "findings": { "type": "array" },
    "limitations": { "type": "string" },
    "residual_risk": { "type": "string" },
    "deployment_readiness_opinion": { "type": "string" },
    "validity_period": { "type": "string" },
    "revalidation_triggers": { "type": "array" },
    "material_change": { "type": "boolean" },
    "unresolved_concern": { "type": "boolean" },
    "expired": { "type": "boolean" },
    "evaluator_conflict": { "type": "boolean" },
    "high_consequence": { "type": "boolean" },
    "shutdown_evidence_present": { "type": "boolean" },
    "authority_effect": {
      "type": "string",
      "const": "NONE"
    },
    "qualification_evidence": {
      "type": "object",
      "description": "Submitted bounded summary only. Not native authentication and not certification of truth.",
      "additionalProperties": false,
      "required": [
        "qualification_id",
        "principal_ref",
        "role",
        "scope",
        "subject_id",
        "configuration_digest",
        "competence_evidence_refs",
        "qualified_from",
        "expires_at",
        "outcome",
        "authority_effect"
      ],
      "properties": {
        "qualification_id": { "type": "string", "minLength": 1 },
        "principal_ref": { "type": "string", "minLength": 1 },
        "role": { "type": "string", "minLength": 1 },
        "scope": { "type": "string", "minLength": 1 },
        "subject_id": { "type": "string", "minLength": 1 },
        "configuration_digest": { "type": "string", "pattern": "^sha256:[a-f0-9]{64}$" },
        "competence_evidence_refs": {
          "type": "array",
          "minItems": 1,
          "items": { "type": "string", "minLength": 1 }
        },
        "qualified_from": { "type": "string", "pattern": "^\\d{4}-\\d{2}-\\d{2}T\\d{2}:\\d{2}:\\d{2}Z$" },
        "expires_at": { "type": "string", "pattern": "^\\d{4}-\\d{2}-\\d{2}T\\d{2}:\\d{2}:\\d{2}Z$" },
        "outcome": { "type": "string", "enum": ["QUALIFIED", "CONDITIONAL", "NOT_QUALIFIED"] },
        "authority_effect": { "type": "string", "const": "NONE" }
      }
    }
  },
  "required": ["subject_id", "authority_effect"],
  "additionalProperties": false
}
